{
  "schemaVersion": 1,
  "format": "embeddedknowledge-diagram-v1",
  "id": "diagram-one-driver-many-outcomes",
  "type": "concept-map",
  "direction": "left-to-right",
  "alt": "A driver mutation plus other controls still holding gives a clone in working tissue; that clone plus more drivers over decades, and several controls failing too, is what gives growth that does not end.",
  "longDescription": "Six ideas joined by five contributing links. Every link means the thing it starts from contributes to the thing it points at, so the two outcomes in the map each have more than one contributor and neither has only one. Three ideas start the map because nothing points into them: a driver mutation, other controls still hold, and several controls fail too. Two links converge on the first outcome, a clone in working tissue: one from a driver mutation, and one from other controls still hold, meaning attachment, the death programme and the response to crowding are all still working. So a single driver gives a clone and not a cancer, because the tissue's other controls are contributing to that outcome as much as the mutation is. From the clone in working tissue a link leads to more drivers over decades, a typical tumour carrying two to eight driver mutations. Two links then converge on the second outcome, growth that does not end: one from more drivers over decades, and one from several controls fail too. Read the two outcomes by comparing what feeds them. The driver mutation lies on the path to both, since it is upstream of the clone and the clone is upstream of the second outcome. What differs between the two outcomes is the third and fifth ideas: whether the tissue's other controls are still holding or have given way. That is the conclusion of the map, that the mutation alone does not select which outcome occurs.",
  "nodes": [
    {
      "id": "node-driver",
      "label": "A driver mutation",
      "shape": "pill",
      "group": "genome"
    },
    {
      "id": "node-controls-hold",
      "label": "Other controls still hold",
      "shape": "rounded-box",
      "group": "context"
    },
    {
      "id": "node-clone",
      "label": "A clone in working tissue",
      "shape": "box",
      "group": "outcome"
    },
    {
      "id": "node-more-drivers",
      "label": "More drivers over decades",
      "shape": "pill",
      "group": "genome"
    },
    {
      "id": "node-controls-fail",
      "label": "Several controls fail too",
      "shape": "rounded-box",
      "group": "context"
    },
    {
      "id": "node-unending",
      "label": "Growth that does not end",
      "shape": "box",
      "group": "outcome"
    }
  ],
  "edges": [
    {
      "id": "edge-driver-clone",
      "from": "node-driver",
      "to": "node-clone",
      "kind": "directed",
      "label": "one driver contributes a growth advantage"
    },
    {
      "id": "edge-controls-hold-clone",
      "from": "node-controls-hold",
      "to": "node-clone",
      "kind": "directed",
      "label": "attachment, the death programme and the crowding response still working is why the outcome is a clone"
    },
    {
      "id": "edge-clone-more-drivers",
      "from": "node-clone",
      "to": "node-more-drivers",
      "kind": "directed",
      "label": "over decades; a typical tumour carries two to eight drivers"
    },
    {
      "id": "edge-more-drivers-unending",
      "from": "node-more-drivers",
      "to": "node-unending",
      "kind": "directed",
      "label": "the accumulated drivers contribute to this outcome"
    },
    {
      "id": "edge-controls-fail-unending",
      "from": "node-controls-fail",
      "to": "node-unending",
      "kind": "directed",
      "label": "and so does the giving way of the tissue's own controls"
    }
  ]
}
