{
  "schemaVersion": 1,
  "format": "embeddedknowledge-diagram-v1",
  "id": "diagram-scale-ladder",
  "type": "flow",
  "direction": "top-to-bottom",
  "alt": "A ladder of five sizes running from the 0.1 mm limit of unaided vision down to the 2 nm width of the DNA double helix, with a modelled crypt opening, one crypt cell, and the light-microscope limit in between.",
  "longDescription": "Five rungs, largest at the top. Rung one: the finest detail the unaided eye separates, about 0.1 millimetres, which is 100 micrometres. Rung two: a modelled colonic crypt opening. In a simplified circular model, 22 cells of about 10 micrometres around the perimeter imply an opening about 70 micrometres across, which is finer than the eye threshold and so is not resolved by it. Rung three: one colonic epithelial cell, about 10 to 20 micrometres across, five to ten times finer than the eye threshold, and that is the gap a lens had to close. Rung four: the finest detail a conventional light microscope separates, about 0.25 micrometres, which is 250 nanometres. Rung five: the DNA double helix, about 2 nanometres across, roughly a hundred times finer than the light-microscope limit, so no conventional light microscope shows it. Crypt depth is not used to decide what a surface view resolves.",
  "nodes": [
    {
      "id": "node-eye-limit",
      "label": "Unaided eye: finest detail separated, about 0.1 mm (100 µm)",
      "shape": "box",
      "group": "threshold"
    },
    {
      "id": "node-crypt-opening",
      "label": "Modelled crypt opening: about 70 µm across",
      "shape": "rounded-box",
      "group": "structure"
    },
    {
      "id": "node-crypt-cell",
      "label": "One colonic epithelial cell: about 10 to 20 µm across",
      "shape": "rounded-box",
      "group": "structure"
    },
    {
      "id": "node-microscope-limit",
      "label": "Light microscope: finest detail separated, about 0.25 µm (250 nm)",
      "shape": "box",
      "group": "threshold"
    },
    {
      "id": "node-dna-helix",
      "label": "DNA double helix: about 2 nm across",
      "shape": "rounded-box",
      "group": "structure"
    }
  ],
  "edges": [
    {
      "id": "edge-eye-opening",
      "from": "node-eye-limit",
      "to": "node-crypt-opening",
      "kind": "directed",
      "label": "the opening is finer than the threshold, so a surface view does not resolve it"
    },
    {
      "id": "edge-opening-cell",
      "from": "node-crypt-opening",
      "to": "node-crypt-cell",
      "kind": "directed",
      "label": "22 cells of about 10 µm around the perimeter give that opening"
    },
    {
      "id": "edge-cell-microscope",
      "from": "node-crypt-cell",
      "to": "node-microscope-limit",
      "kind": "directed",
      "label": "cell is 40 to 80 times wider than the lens limit"
    },
    {
      "id": "edge-microscope-dna",
      "from": "node-microscope-limit",
      "to": "node-dna-helix",
      "kind": "directed",
      "label": "lens limit is about 100 times wider than the helix"
    }
  ]
}
